{
  "$schema": "https://json-schema.org/draft/2020-12/schema",
  "$id": "https://example.invalid/code-review-agent/swebench-repair/run-plan.schema.json",
  "title": "Week 5 SWE-bench Repair run plan",
  "type": "object",
  "additionalProperties": false,
  "required": [
    "schema_version",
    "run_plan_id",
    "cohort_id",
    "config_plan_id",
    "source_commit",
    "agent_source_commit",
    "gold_freeze_commit",
    "freeze_attestation_sha256",
    "created_at",
    "cohort_sha256",
    "config_sha256",
    "selection_log_sha256",
    "dataset_manifest_sha256",
    "harness_revision",
    "rows"
  ],
  "properties": {
    "schema_version": {
      "const": 1
    },
    "run_plan_id": {
      "$ref": "#/$defs/sha256"
    },
    "cohort_id": {
      "$ref": "#/$defs/identifier"
    },
    "config_plan_id": {
      "$ref": "#/$defs/identifier"
    },
    "source_commit": {
      "$ref": "#/$defs/sha1"
    },
    "agent_source_commit": {
      "$ref": "#/$defs/sha1"
    },
    "gold_freeze_commit": {
      "$ref": "#/$defs/sha1"
    },
    "freeze_attestation_sha256": {
      "$ref": "#/$defs/sha256"
    },
    "created_at": {
      "$ref": "#/$defs/timestamp"
    },
    "cohort_sha256": {
      "$ref": "#/$defs/sha256"
    },
    "config_sha256": {
      "$ref": "#/$defs/sha256"
    },
    "selection_log_sha256": {
      "$ref": "#/$defs/sha256"
    },
    "dataset_manifest_sha256": {
      "$ref": "#/$defs/sha256"
    },
    "harness_revision": {
      "$ref": "#/$defs/sha1"
    },
    "rows": {
      "type": "array",
      "minItems": 1,
      "items": {
        "$ref": "#/$defs/row"
      }
    }
  },
  "$defs": {
    "identifier": {
      "type": "string",
      "pattern": "^[A-Za-z0-9][A-Za-z0-9_.-]{0,127}$"
    },
    "repository": {
      "type": "string",
      "pattern": "^[a-z0-9][a-z0-9_.-]*/[a-z0-9][a-z0-9_.-]*$"
    },
    "sha1": {
      "type": "string",
      "pattern": "^[0-9a-f]{40}$"
    },
    "sha256": {
      "type": "string",
      "pattern": "^[0-9a-f]{64}$"
    },
    "image_digest": {
      "type": "string",
      "pattern": "^sha256:[0-9a-f]{64}$"
    },
    "timestamp": {
      "type": "string",
      "pattern": "^\\d{4}-\\d{2}-\\d{2}T\\d{2}:\\d{2}:\\d{2}Z$"
    },
    "budget": {
      "type": "object",
      "additionalProperties": false,
      "required": [
        "total_seconds",
        "total_tokens",
        "total_cost_microusd",
        "tool_calls",
        "repair_attempts",
        "test_command_invocations",
        "command_seconds",
        "command_output_bytes"
      ],
      "properties": {
        "total_seconds": {
          "type": "integer",
          "minimum": 1
        },
        "total_tokens": {
          "type": "integer",
          "minimum": 1
        },
        "total_cost_microusd": {
          "type": "integer",
          "minimum": 1
        },
        "tool_calls": {
          "type": "integer",
          "minimum": 1
        },
        "repair_attempts": {
          "type": "integer",
          "minimum": 0
        },
        "test_command_invocations": {
          "type": "integer",
          "minimum": 1
        },
        "command_seconds": {
          "type": "integer",
          "minimum": 1
        },
        "command_output_bytes": {
          "type": "integer",
          "minimum": 1
        }
      }
    },
    "isolation": {
      "type": "object",
      "additionalProperties": false,
      "required": [
        "cpus",
        "memory_mib",
        "pids",
        "writable_mib",
        "network_mode",
        "read_only_root",
        "run_as_non_root",
        "cap_drop_all",
        "no_new_privileges",
        "maximum_parallel_runs"
      ],
      "properties": {
        "cpus": {
          "const": 2
        },
        "memory_mib": {
          "const": 4096
        },
        "pids": {
          "const": 256
        },
        "writable_mib": {
          "const": 20480
        },
        "network_mode": {
          "const": "none"
        },
        "read_only_root": {
          "const": true
        },
        "run_as_non_root": {
          "const": true
        },
        "cap_drop_all": {
          "const": true
        },
        "no_new_privileges": {
          "const": true
        },
        "maximum_parallel_runs": {
          "const": 2
        }
      }
    },
    "row": {
      "type": "object",
      "additionalProperties": false,
      "required": [
        "schema_version",
        "run_plan_id",
        "instance_id",
        "repository",
        "configuration_id",
        "configuration_sha256",
        "purpose",
        "run_id",
        "task_branch",
        "worktree_id",
        "worktree_path_token_sha256",
        "container_name",
        "judge_container_name",
        "state_id",
        "base_sha",
        "base_tree_sha256",
        "source_snapshot_sha256",
        "harness_task_sha256",
        "image_digest",
        "fail_to_pass_count",
        "pass_to_pass_count",
        "budget",
        "isolation"
      ],
      "properties": {
        "schema_version": {
          "const": 1
        },
        "run_plan_id": {
          "$ref": "#/$defs/sha256"
        },
        "instance_id": {
          "$ref": "#/$defs/identifier"
        },
        "repository": {
          "$ref": "#/$defs/repository"
        },
        "configuration_id": {
          "enum": [
            "primary",
            "single_finder",
            "no_context",
            "no_verifier",
            "no_reflection",
            "model_b"
          ]
        },
        "configuration_sha256": {
          "$ref": "#/$defs/sha256"
        },
        "purpose": {
          "enum": [
            "final_report",
            "ablation_report"
          ]
        },
        "run_id": {
          "$ref": "#/$defs/identifier"
        },
        "task_branch": {
          "type": "string",
          "pattern": "^repair/[a-z0-9-]+$"
        },
        "worktree_id": {
          "$ref": "#/$defs/identifier"
        },
        "worktree_path_token_sha256": {
          "$ref": "#/$defs/sha256"
        },
        "container_name": {
          "$ref": "#/$defs/identifier"
        },
        "judge_container_name": {
          "$ref": "#/$defs/identifier"
        },
        "state_id": {
          "$ref": "#/$defs/identifier"
        },
        "base_sha": {
          "$ref": "#/$defs/sha1"
        },
        "base_tree_sha256": {
          "$ref": "#/$defs/sha256"
        },
        "source_snapshot_sha256": {
          "$ref": "#/$defs/sha256"
        },
        "harness_task_sha256": {
          "$ref": "#/$defs/sha256"
        },
        "image_digest": {
          "$ref": "#/$defs/image_digest"
        },
        "fail_to_pass_count": {
          "type": "integer",
          "minimum": 1
        },
        "pass_to_pass_count": {
          "type": "integer",
          "minimum": 0
        },
        "budget": {
          "$ref": "#/$defs/budget"
        },
        "isolation": {
          "$ref": "#/$defs/isolation"
        }
      }
    }
  }
}
